<?xml version="1.0" encoding="utf-8"?>
<NationalPark xmlns:xsi="http://www.w3.org/2001/XMLSchema-instance" xsi:noNamespaceSchemaLocation="NationalParks.xsd">

  <NationalPark Rating="4.9">
    <Name>Grand Canyon</Name>
    <Address NearestAirport="FlagStaff">
      <Number>8</Number>
      <Street>S Entrance Road</Street>
      <City>Grand Canyon</City>
      <State>AZ</State>
      <Zip>86023</Zip>
    </Address>
  </NationalPark>

  <NationalPark Rating="4.8">
    <Name>Yellowstone</Name>
    <Phone>307-344-7381</Phone>
    <Address>
      <Number>1</Number>
      <Street>Grand Loop Rd</Street>
      <City>Yellowstone National Park</City>
      <State>WY</State>
      <Zip>82190</Zip>
    </Address>
  </NationalPark>

  <NationalPark Rating="4.9">
    <Name>Yosemite</Name>
    <Name>Yosemite National Park</Name>
    <Phone>209-372-0200</Phone>
    <Address NearestAirport="Fresno">
      <Number>9039</Number>
      <Street>Village Dr</Street>
      <City>Yosemite Valley</City>
      <State>CA</State>
      <Zip>95389</Zip>
    </Address>
  </NationalPark>

  <NationalPark>
    <Name>Zion</Name>
    <Phone>435-772-3256</Phone>
    <Address NearestAirport="St George">
      <Number>1</Number>
      <Street>Zion Park Blvd</Street>
      <City>Springdale</City>
      <State>UT</State>
      <Zip>84767</Zip>

</NationalPark>
