<?xml version="1.0" encoding="utf-8"?>
<NationalParks xmlns:xsi="http://www.w3.org/2001/XMLSchema-instance" xsi:noNamespaceSchemaLocation="NationalParks.xsd">
  <NationalPark Rating="4.9">
    <Name>Grand Canyon</Name>
    <Phone>928-638-7496</Phone>
    <Phone>888-297-2757</Phone>
    <Phone>866-499-2574</Phone>
    <Address NearestAirport="FlagStaff">
      <Number>8</Number>
      <Street>S Entrance Road</Street>
      <City>Grand Canyon</City>
      <State>AZ</State>
      <Zip>86023</Zip>
    </Address>
  </NationalPark>

  <NationalPark Rating="4.8">
    <Name>Yellowstone</Name>
    <Phone>307-344-7381</Phone>
    <Phone>307-344-2107</Phone>
    <Address NearestAirport="Jackson Hole">
      <Number>1</Number>
      <Street>Grand Loop Rd</Street>
      <City>Yellowstone National Park</City>
      <State>WY</State>
      <Zip>82190</Zip>
    </Address>
  </NationalPark>

  <NationalPark Rating="4.9">
    <Name>Yosemite</Name>
    <Phone>209-372-0200</Phone>
    <Address NearestAirport="Fresno">
      <Number>9039</Number>
      <Street>Village Dr</Street>
      <City>Yosemite Valley</City>
      <State>CA</State>
      <Zip>95389</Zip>
    </Address>
  </NationalPark>

  <NationalPark>
    <Name>Zion</Name>
    <Phone>435-772-3256</Phone>
    <Address NearestAirport="St George">
      <Number>1</Number>
      <Street>Zion Park Blvd</Street>
      <City>Springdale</City>
      <State>UT</State>
      <Zip>84767</Zip>
    </Address>
  </NationalPark>

  <NationalPark Rating="4.7">
    <Name>Glacier</Name>
    <Phone>406-888-7800</Phone>
    <Address NearestAirport="Glacier Park">
      <Number>64</Number>
      <Street>Grinnell Dr</Street>
      <City>West Glacier</City>
      <State>MT</State>
      <Zip>59936</Zip>
    </Address>
  </NationalPark>

  <NationalPark>
    <Name>Rocky Mountain</Name>
    <Phone>970-586-1206</Phone>
    <Address NearestAirport="Denver">
      <Number>1000</Number>
      <Street>US-36</Street>
      <City>Estes Park</City>
      <State>CO</State>
      <Zip>80517</Zip>
    </Address>
  </NationalPark>

  <NationalPark Rating="4.6">
    <Name>Olympic</Name>
    <Phone>360-565-3130</Phone>
    <Address NearestAirport="Seattle">
      <Number>3002</Number>
      <Street>Mount Angeles Rd</Street>
      <City>Port Angeles</City>
      <State>WA</State>
      <Zip>98362</Zip>
    </Address>
  </NationalPark>

  <NationalPark>
    <Name>Great Smoky Mountains</Name>
    <Phone>865-436-1200</Phone>
    <Address NearestAirport="Knoxville">
      <Number>107</Number>
      <Street>Park Headquarters Rd</Street>
      <City>Gatlinburg</City>
      <State>TN</State>
      <Zip>37738</Zip>
    </Address>
  </NationalPark>

  <NationalPark Rating="4.8">
    <Name>Acadia</Name>
    <Phone>207-288-3338</Phone>
    <Phone>207-288-8832</Phone>
    <Address NearestAirport="Bar Harbor">
      <Number>25</Number>
      <Street>Visitor Center Rd</Street>
      <City>Bar Harbor</City>
      <State>ME</State>
      <Zip>04609</Zip>
    </Address>
  </NationalPark>

  <NationalPark>
    <Name>Joshua Tree</Name>
    <Phone>760-343-5500</Phone>
    <Address NearestAirport="Palm Springs">
      <Number>74485</Number>
      <Street>National Park Dr</Street>
      <City>Twentynine Palms</City>
      <State>CA</State>
      <Zip>92277</Zip>
    </Address>
  </NationalPark>

  <NationalPark>
    <Name>Bryce Canyon</Name>
    <Phone>435-834-5322</Phone>
    <Address NearestAirport="Cedar City">
      <Number>1</Number>
      <Street>Bryce Canyon National Park</Street>
      <City>Bryce Canyon City</City>
      <State>UT</State>
      <Zip>84717</Zip>
    </Address>
  </NationalPark>
</NationalParks>
